{
  "$schema": "https://json-schema.org/draft/2020-12/schema",
  "$id": "https://memory-workspace.dev/schemas/capture-event.schema.json",
  "title": "Asynchronous capture event",
  "type": "object",
  "additionalProperties": false,
  "required": [
    "schema_version",
    "event_id",
    "created_at",
    "expires_at",
    "source",
    "payload",
    "privacy"
  ],
  "properties": {
    "schema_version": {"const": 1},
    "event_id": {"type": "string", "pattern": "^evt_[A-Za-z0-9_-]+$"},
    "created_at": {"type": "string", "format": "date-time"},
    "expires_at": {"type": "string", "format": "date-time"},
    "source": {
      "type": "object",
      "additionalProperties": false,
      "required": ["agent", "conversation_id", "message_id", "workspace_id"],
      "properties": {
        "agent": {"type": "string", "minLength": 1},
        "conversation_id": {"type": ["string", "null"]},
        "message_id": {"type": ["string", "null"]},
        "workspace_id": {"type": ["string", "null"]}
      }
    },
    "payload": {
      "type": "object",
      "additionalProperties": false,
      "required": ["user_message", "assistant_summary"],
      "properties": {
        "user_message": {"type": "string", "minLength": 1},
        "assistant_summary": {"type": ["string", "null"]}
      }
    },
    "privacy": {"const": "local_plaintext_staging"}
  }
}
