{
  "schema_version": 1,
  "event_id": "evt_20260824T120000Z_example",
  "created_at": "2026-08-24T12:00:00Z",
  "expires_at": "2026-08-31T12:00:00Z",
  "source": {
    "agent": "example-agent",
    "conversation_id": "conv-example",
    "message_id": null,
    "workspace_id": "example-project"
  },
  "payload": {
    "user_message": "Use a platform-neutral compatibility layer.",
    "assistant_summary": null
  },
  "privacy": "local_plaintext_staging"
}
